{
  "case_id": "pandas-cpp-xsimd-neon64-v2-001",
  "split": "v2/holdout",
  "origin": "new_v2",
  "ecosystem": "c-cpp-cmake",
  "primary_language": "cpp",
  "ci_provider": "github_actions",
  "repo_visibility": "public",
  "failure_category": "compile_error",
  "framework": "generic",
  "log_size_bucket": "medium",
  "signal_position": "late",
  "evidence_formats": [
    "compiler_diagnostic",
    "ansi_colored_block",
    "github_annotation",
    "package_manager_error"
  ],
  "noise_profile": [
    "runner_setup",
    "dependency_install_noise",
    "verbose_build_noise"
  ],
  "multi_failure": false,
  "flaky_or_transient": false,
  "requires_repo_context": false,
  "diagnosis_difficulty": "medium",
  "notes": "C++ template-instantiation compile error in pandas's perf branch (xsimd::neon64 vs xsimd::neon mismatch). Adds compile_error case (v1.3 had 1/16, v2 now has 2). First v2 case with `c-cpp-cmake` ecosystem and primary_language=cpp — fills another v1.3 gap (was 0/16, target 2 in v2). Note: project uses meson+ninja rather than CMake, but `c-cpp-cmake` is the closest matching ecosystem in the v2 enum. multi_failure=false because both compile-unit failures share one root cause (the header-level extern template declaration is wrong)."
}
